{
  "assumptions": [],
  "guarantees": [
    {
      "condition": "state_nominal & limits",
      "condition-type": "trigger",
      "response": "STATE_FAULT",
      "timing": { "type": "Always" }
    },
    {
      "condition": "state_nominal & !request & !limits",
      "condition-type": "trigger",
      "response": "STATE_TRANSITION",
      "timing": { "type": "Always" }
    },
    {
      "condition": "true",
      "condition-type": "continual",
      "response": "!(STATE_FAULT & STATE_TRANSITION)",
      "timing": { "type": "Always" },
      "weakenable": false
    }
  ],
  "in_atoms": ["state_nominal", "limits", "request"],
  "out_atoms": ["STATE_FAULT", "STATE_TRANSITION"]
}
