{
  "assumptions": [],
  "guarantees": [
    {
      "condition": "state_nominal & limits & request",
      "condition-type": "trigger",
      "response": "STATE_FAULT",
      "timing": { "type": "Always" }
    },
    {
      "condition": "state_nominal & !request",
      "condition-type": "trigger",
      "response": "STATE_TRANSITION",
      "timing": { "type": "Always" }
    },
    {
      "condition": "state_maneuver & standby & good",
      "condition-type": "trigger",
      "response": "STATE_STANDBY",
      "timing": { "type": "ForTicks", "ticks": 4 }
    },
    {
      "condition": "state_maneuver & supported & good",
      "condition-type": "trigger",
      "response": "STATE_TRANSITION",
      "timing": { "type": "WithinTicks", "ticks": 5 }
    },
    {
      "condition": "true",
      "condition-type": "continual",
      "response": "!(state_nominal & state_maneuver)",
      "timing": { "type": "Always" },
      "weakenable": false
    },
    {
      "condition": "true",
      "condition-type": "continual",
      "response": "!(STATE_FAULT & STATE_STANDBY & STATE_TRANSITION)",
      "timing": { "type": "Always" },
      "weakenable": false
    }
  ],
  "in_atoms": ["state_nominal", "state_maneuver", "limits", "request", "standby", "supported", "good"],
  "out_atoms": ["STATE_FAULT", "STATE_STANDBY", "STATE_TRANSITION"]
}
